{
  "run_id": "run_0008",
  "created": "2026-09-03T05:20:20Z",
  "parent_run": null,
  "site": {
    "site_id": "site_68043",
    "name": "Mountain Road Tech Park, Hanover County VA (REJECTED 4-3, May 2026)",
    "centroid": [
      37.6871,
      -77.5438
    ],
    "radius_km": 10.0,
    "geometry": null,
    "country": "United States",
    "admin1": "Virginia",
    "admin2": "Hanover County",
    "utility": null,
    "market": "PJM",
    "origin": "manual",
    "hypothesis": null,
    "notes": null
  },
  "assumptions": {},
  "weight_overrides": {},
  "cooling_assumption": "hybrid_adiabatic",
  "measurements": [
    {
      "factor_id": "pwr.transmission_proximity",
      "value": 2.68,
      "unit": "km",
      "tier": "A",
      "source": "osm_overpass",
      "source_url": "https://www.openstreetmap.org/copyright",
      "retrieved": "2026-09-03T05:20:27Z",
      "geometry_ref": "geohash:dq8y7kw",
      "raw": {
        "voltage_kv": 230.0,
        "qualifying_lines": 392,
        "operator": "Virginia Electric and Power Company",
        "distance_by_kv": {
          "500.0": 5.27,
          "230.0": 2.68,
          "115.0": 3.62,
          "34.5": 32.97
        }
      },
      "unknown_reason": null,
      "notes": "230 kV line at 2.7 km; 392 line(s) at or above 230 kV within 60 km. Proximity is not capacity \u2014 read with pwr.substation_headroom.",
      "id": "m_4c29658c8571"
    },
    {
      "factor_id": "pwr.substation_headroom",
      "value": null,
      "unit": "MVA",
      "tier": "unknown",
      "source": "osm_overpass",
      "source_url": null,
      "retrieved": "2026-09-03T05:20:59Z",
      "geometry_ref": null,
      "raw": null,
      "unknown_reason": "all Overpass mirrors failed: HTTP 504 from https://overpass.kumi.systems/api/interpreter",
      "notes": null,
      "id": "m_175b4725f837"
    },
    {
      "factor_id": "pwr.onsite_generation_potential",
      "value": 39.3,
      "unit": "index_0_100",
      "tier": "C",
      "source": "composite",
      "source_url": null,
      "retrieved": "2026-09-03T05:21:32Z",
      "geometry_ref": null,
      "raw": {
        "gas_pipeline_km": null,
        "_gas_error": "all Overpass mirrors failed: HTTP 504 from https://overpass.kumi.systems/api/interpreter",
        "ghi_kwh_m2_day": 4.27,
        "gas_component": null,
        "solar_component": 39.3
      },
      "unknown_reason": null,
      "notes": "Composite: gas pipeline not found km, GHI 4.27 kWh/m2/day (35% weight). Wind and land-for-generation components not yet implemented \u2014 index is therefore conservative. Solar/wind cannot firm a data center load; counted here only for a hybrid or bridging strategy.",
      "id": "m_b4756a53f330"
    },
    {
      "factor_id": "wtr.wetbulb_profile",
      "value": 347.5,
      "unit": "hours_above_24C_wetbulb",
      "tier": "A",
      "source": "open_meteo_archive",
      "source_url": "https://archive-api.open-meteo.com/v1/archive",
      "retrieved": "2026-09-03T05:21:35Z",
      "geometry_ref": "geohash:dq8y7kw",
      "raw": {
        "design_wetbulb_04pct_C": 25.6,
        "mean_wetbulb_C": 11.71,
        "years": 10.0,
        "hours_sampled": 87660
      },
      "unknown_reason": null,
      "notes": "Design wet-bulb (0.4% exceedance) 25.6 C; mean 11.7 C. Computed from 10 yr of ERA5 hourly reanalysis via Stull (2011).",
      "id": "m_05a4aa7a4d64"
    },
    {
      "factor_id": "wtr.reclaimed_availability",
      "value": null,
      "unit": "km",
      "tier": "unknown",
      "source": "osm_overpass",
      "source_url": null,
      "retrieved": "2026-09-03T05:22:08Z",
      "geometry_ref": null,
      "raw": null,
      "unknown_reason": "all Overpass mirrors failed: HTTP 504 from https://overpass.kumi.systems/api/interpreter",
      "notes": null,
      "id": "m_5490ba60201e"
    },
    {
      "factor_id": "clm.dry_bulb_profile",
      "value": 6940.8,
      "unit": "free_cooling_hours_per_year",
      "tier": "A",
      "source": "open_meteo_archive",
      "source_url": "https://archive-api.open-meteo.com/v1/archive",
      "retrieved": "2026-09-03T05:22:08Z",
      "geometry_ref": "geohash:dq8y7kw",
      "raw": {
        "design_drybulb_04pct_C": 35.5,
        "mean_drybulb_C": 15.35,
        "indicative_annual_pue": 1.146,
        "threshold_C": 24.0
      },
      "unknown_reason": null,
      "notes": "6941 h/yr below 24.0 C. Design dry-bulb 35.5 C. Indicative PUE 1.146 \u2014 a screening proxy, not a CFD-grade model.",
      "id": "m_20f8fbedd142"
    },
    {
      "factor_id": "clm.extreme_heat_trend",
      "value": 1.69,
      "unit": "delta_C_design_day_2050",
      "tier": "D",
      "source": "open_meteo_archive",
      "source_url": "https://archive-api.open-meteo.com/v1/archive",
      "retrieved": "2026-09-03T05:22:08Z",
      "geometry_ref": "geohash:dq8y7kw",
      "raw": {
        "observed_slope_C_per_year": 0.0702,
        "years_used": 30
      },
      "unknown_reason": null,
      "notes": "MODELED, NOT PROJECTED: linear extrapolation of the observed 30-year trend in annual design-day temperature (+0.070 C/yr). This is a placeholder for NEX-GDDP-CMIP6 and should not be cited as a climate projection.",
      "id": "m_de4a06b7bbf1"
    },
    {
      "factor_id": "clm.flood_riverine",
      "value": 1000,
      "unit": "return_period_years",
      "tier": "A",
      "source": "fema_nfhl",
      "source_url": "https://msc.fema.gov/portal/home",
      "retrieved": "2026-09-03T05:22:09Z",
      "geometry_ref": "geohash:dq8y7kw",
      "raw": {
        "zones": [],
        "in_sfha": false
      },
      "unknown_reason": null,
      "notes": "Outside mapped FEMA flood hazard areas. Note that NFHL does not model pluvial (flash) flooding, which no widely-available dataset captures well \u2014 this is a known blind spot, not a clean bill of health.",
      "id": "m_b112d708562c"
    },
    {
      "factor_id": "lnd.slope",
      "value": 0.99,
      "unit": "percent_slope",
      "tier": "A",
      "source": "opentopography",
      "source_url": "https://www.opentopodata.org/datasets/copernicus/",
      "retrieved": "2026-09-03T05:22:10Z",
      "geometry_ref": "geohash:dq8y7kw",
      "raw": {
        "dem_dataset": "mapzen",
        "p90_slope_pct": 1.63,
        "mean_elevation_m": 70.2,
        "min_elevation_m": 51.0,
        "max_elevation_m": 81.0,
        "relief_m": 30.0,
        "sample_points": 25,
        "sample_radius_km": 2.0
      },
      "unknown_reason": null,
      "notes": "mapzen DEM, 5x5 grid over 2.0 km. Mean slope 1.0%, p90 1.6%, relief 30 m. Below 2% is essentially free; earthwork cost rises roughly quadratically above that for a large flat-pad campus.",
      "id": "m_7f39b5e6700e"
    },
    {
      "factor_id": "lnd.contiguous_area",
      "value": null,
      "unit": "hectares",
      "tier": "unknown",
      "source": "osm_overpass",
      "source_url": null,
      "retrieved": "2026-09-03T05:22:44Z",
      "geometry_ref": null,
      "raw": null,
      "unknown_reason": "all Overpass mirrors failed: HTTP 504 from https://overpass.kumi.systems/api/interpreter",
      "notes": null,
      "id": "m_d8f187c90729"
    },
    {
      "factor_id": "lnd.brownfield_opportunity",
      "value": "heavy_industrial_reuse",
      "unit": "category",
      "tier": "C",
      "source": "osm_overpass",
      "source_url": "https://www.openstreetmap.org/copyright",
      "retrieved": "2026-09-03T05:22:47Z",
      "geometry_ref": "geohash:dq8y7kw",
      "raw": {
        "power_plants": [
          {
            "distance_km": 2.31,
            "source": "biogas",
            "name": "Henrico Power Plant",
            "output_mw": "3.6 MW"
          }
        ],
        "brownfield_polygons": 0,
        "industrial_polygons": 44
      },
      "unknown_reason": null,
      "notes": "1 power plant(s) within 8 km; nearest Henrico Power Plant (biogas) at 2.31 km. CHECK RETIREMENT STATUS \u2014 a retiring plant is the highest-value site category available, because interconnection rights, transmission, water rights and often the land itself are already in place.",
      "id": "m_1f168a720336"
    },
    {
      "factor_id": "cnx.ixp_proximity",
      "value": 8.58,
      "unit": "km",
      "tier": "A",
      "source": "peeringdb",
      "source_url": "https://www.peeringdb.com/fac/2075",
      "retrieved": "2026-09-03T05:22:49Z",
      "geometry_ref": "geohash:dq8y7kw",
      "raw": {
        "facility": "EdgeConneX Richmond (EDCRIC01)",
        "city": "Richmond",
        "country": "US",
        "facilities_within_100km": 7,
        "nearest_five": [
          {
            "name": "EdgeConneX Richmond (EDCRIC01)",
            "km": 8.6
          },
          {
            "name": "Pixel Factory Data Center",
            "km": 9.5
          },
          {
            "name": "Hosted Backbone Richmond1",
            "km": 10.3
          },
          {
            "name": "Flexential - Richmond (RIC01/02)",
            "km": 10.3
          },
          {
            "name": "QTS Richmond - (RIC5)",
            "km": 32.3
          }
        ]
      },
      "unknown_reason": null,
      "notes": "Nearest interconnection facility 'EdgeConneX Richmond (EDCRIC01)' at 8.6 km; 7 facilities within 100 km. Weight this near zero for a training campus \u2014 over-weighting it biases site selection toward expensive metro land.",
      "id": "m_4af3bdbdc5ba"
    },
    {
      "factor_id": "cnx.carrier_count",
      "value": 38,
      "unit": "count_carriers",
      "tier": "B",
      "source": "peeringdb",
      "source_url": "https://www.peeringdb.com/",
      "retrieved": "2026-09-03T05:22:49Z",
      "geometry_ref": "geohash:dq8y7kw",
      "raw": {
        "facilities_within_radius": 6,
        "network_presences": 38,
        "radius_km": 50.0
      },
      "unknown_reason": null,